<?xml version="1.0" encoding="UTF-8"?>

<circuito xmlns="http://www.uniovi.es"
            xmlns:xsi="http://www.w3.org/2001/XMLSchema-instance"
            xsi:schemaLocation="http://www.uniovi.es circuito.xsd">

    <nombre>Sachsenring</nombre>
    <pais>Alemania</pais>
    <localidad>Hohenstein-Ernstthal</localidad>

    <longitudCircuito unidades="metros">3671</longitudCircuito>
    <anchuraMedia unidades="metros">12</anchuraMedia>

    <carrera>
        <fecha>2025-07-13</fecha>
        <horaEspaña>14:00:00</horaEspaña>
        <vueltas>30</vueltas>
        <patrocinador>Liqui Moly Grand Prix of Germany 2025</patrocinador>
        <resultado>
            <vencedor>Marc Márquez</vencedor>
            <tiempo>PT40M42.854S</tiempo>
        </resultado>
        <clasificacionMundial>
            <posicion numero="1">
                <piloto>Marc Márquez</piloto>
            </posicion>
            <posicion numero="2">
                <piloto>Álex Márquez</piloto>
            </posicion>
            <posicion numero="3">
                <piloto>Francesco Bagnaia</piloto>
            </posicion>
        </clasificacionMundial>
    </carrera>

    <ubicacion>

        <origen>
            <longitud unidades="grados">12.68807724922379</longitud>
            <latitud unidades="grados">50.79175728835934</latitud>
            <altitud unidades="metros sobre el nivel del mar">330.9438399535764</altitud>
        </origen>

        <trazado>
            <tramo>
                <distancia unidades="metros">85.91</distancia>
                <coordenadas>
                    <longitud unidades="grados">12.68908061890597</longitud>
                    <latitud unidades="grados">50.79219826200591</latitud>
                    <altitud unidades="metros sobre el nivel del mar">332.3669225791181</altitud>
                </coordenadas>
                <sector>1</sector>
            </tramo>
            <tramo>
                <distancia unidades="metros">84.72</distancia>
                <coordenadas>
                    <longitud unidades="grados">12.69007240802596</longitud>
                    <latitud unidades="grados">50.79263084800947</latitud>
                    <altitud unidades="metros sobre el nivel del mar">334.4603283370987</altitud>
                </coordenadas>
                <sector>1</sector>
            </tramo>
            <tramo>
                <distancia unidades="metros">78.72</distancia>
                <coordenadas>
                    <longitud unidades="grados">12.6910001975818</longitud>
                    <latitud unidades="grados">50.7930274212857</latitud>
                    <altitud unidades="metros sobre el nivel del mar">334.5345884006572</altitud>
                </coordenadas>
                <sector>1</sector>
            </tramo>
            <tramo>
                <distancia unidades="metros">57.98</distancia>
                <coordenadas>
                    <longitud unidades="grados">12.69170307082403</longitud>
                    <latitud unidades="grados">50.79330017934584</latitud>
                    <altitud unidades="metros sobre el nivel del mar">335.4062007700873</altitud>
                </coordenadas>
                <sector>1</sector>
            </tramo>
            <tramo>
                <distancia unidades="metros">22.25</distancia>
                <coordenadas>
                    <longitud unidades="grados">12.69201681957707</longitud>
                    <latitud unidades="grados">50.79332698962793</latitud>
                    <altitud unidades="metros sobre el nivel del mar">335.5130354896287</altitud>
                </coordenadas>
                <sector>1</sector>
            </tramo>
            <tramo>
                <distancia unidades="metros">19.52</distancia>
                <coordenadas>
                    <longitud unidades="grados">12.69227305806282</longitud>
                    <latitud unidades="grados">50.79325955265985</latitud>
                    <altitud unidades="metros sobre el nivel del mar">334.8242575063368</altitud>
                </coordenadas>
                <sector>1</sector>
            </tramo>
            <tramo>
                <distancia unidades="metros">18.07</distancia>
                <coordenadas>
                    <longitud unidades="grados">12.69244784199091</longitud>
                    <latitud unidades="grados">50.79314097118925</latitud>
                    <altitud unidades="metros sobre el nivel del mar">333.4660519861164</altitud>
                </coordenadas>
                <sector>1</sector>
            </tramo>
            <tramo>
                <distancia unidades="metros">18.21</distancia>
                <coordenadas>
                    <longitud unidades="grados">12.69250143269344</longitud>
                    <latitud unidades="grados">50.79298113560176</latitud>
                    <altitud unidades="metros sobre el nivel del mar">332.1979264222489</altitud>
                </coordenadas>
                <sector>1</sector>
            </tramo>
            <tramo>
                <distancia unidades="metros">19.04</distancia>
                <coordenadas>
                    <longitud unidades="grados">12.69242782530024</longitud>
                    <latitud unidades="grados">50.79281644265767</latitud>
                    <altitud unidades="metros sobre el nivel del mar">331.5182076152981</altitud>
                </coordenadas>
                <sector>1</sector>
            </tramo>
            <tramo>
                <distancia unidades="metros">22.55</distancia>
                <coordenadas>
                    <longitud unidades="grados">12.69221304501131</longitud>
                    <latitud unidades="grados">50.79266609018845</latitud>
                    <altitud unidades="metros sobre el nivel del mar">330.5741036809558</altitud>
                </coordenadas>
                <sector>1</sector>
            </tramo>
            <tramo>
                <distancia unidades="metros">20.77</distancia>
                <coordenadas>
                    <longitud unidades="grados">12.69202609504088</longitud>
                    <latitud unidades="grados">50.79252167323293</latitud>
                    <altitud unidades="metros sobre el nivel del mar">329.7032567707009</altitud>
                </coordenadas>
                <sector>1</sector>
            </tramo>
            <tramo>
                <distancia unidades="metros">18.91</distancia>
                <coordenadas>
                    <longitud unidades="grados">12.69189574972202</longitud>
                    <latitud unidades="grados">50.79237302696035</latitud>
                    <altitud unidades="metros sobre el nivel del mar">329.0037242978417</altitud>
                </coordenadas>
                <sector>1</sector>
            </tramo>
            <tramo>
                <distancia unidades="metros">20.50</distancia>
                <coordenadas>
                    <longitud unidades="grados">12.69180568089069</longitud>
                    <latitud unidades="grados">50.79219788168108</latitud>
                    <altitud unidades="metros sobre el nivel del mar">328.0336586837496</altitud>
                </coordenadas>
                <sector>1</sector>
            </tramo>
            <tramo>
                <distancia unidades="metros">20.09</distancia>
                <coordenadas>
                    <longitud unidades="grados">12.69176362927152</longitud>
                    <latitud unidades="grados">50.79201927917431</latitud>
                    <altitud unidades="metros sobre el nivel del mar">327.2412011179225</altitud>
                </coordenadas>
                <sector>1</sector>
            </tramo>
            <tramo>
                <distancia unidades="metros">21.78</distancia>
                <coordenadas>
                    <longitud unidades="grados">12.69179018834349</longitud>
                    <latitud unidades="grados">50.79182428476399</latitud>
                    <altitud unidades="metros sobre el nivel del mar">326.4938636099811</altitud>
                </coordenadas>
                <sector>1</sector>
            </tramo>
            <tramo>
                <distancia unidades="metros">21.40</distancia>
                <coordenadas>
                    <longitud unidades="grados">12.69187102511386</longitud>
                    <latitud unidades="grados">50.79163893799345</latitud>
                    <altitud unidades="metros sobre el nivel del mar">325.5823091947344</altitud>
                </coordenadas>
                <sector>1</sector>
            </tramo>
            <tramo>
                <distancia unidades="metros">25.90</distancia>
                <coordenadas>
                    <longitud unidades="grados">12.69209235126161</longitud>
                    <latitud unidades="grados">50.79145316944232</latitud>
                    <altitud unidades="metros sobre el nivel del mar">324.0798677167049</altitud>
                </coordenadas>
                <sector>1</sector>
            </tramo>
            <tramo>
                <distancia unidades="metros">26.52</distancia>
                <coordenadas>
                    <longitud unidades="grados">12.69241377347812</longitud>
                    <latitud unidades="grados">50.79132957881314</latitud>
                    <altitud unidades="metros sobre el nivel del mar">322.0645358294859</altitud>
                </coordenadas>
                <sector>1</sector>
            </tramo>
            <tramo>
                <distancia unidades="metros">20.64</distancia>
                <coordenadas>
                    <longitud unidades="grados">12.69269283456777</longitud>
                    <latitud unidades="grados">50.79127391638879</latitud>
                    <altitud unidades="metros sobre el nivel del mar">320.3103133508519</altitud>
                </coordenadas>
                <sector>1</sector>